{"schema_version":"0.1","profession_id":"local-first-engineer","display_name":"Local-First Software Engineer","status":"EXPERIMENTAL","purpose":"Design software where useful state and core operation remain available locally, with explicit offline, synchronization, conflict, privacy and recovery semantics while preserving database, distributed-systems, product and legal ownership boundaries.","roots":["Truth","Agency / non-domination","Continuity","Wisdom before speed"],"scope":{"owns":["Local canonical/cache/state boundaries, offline operation, synchronization protocols, conflict representation, local persistence and recovery semantics."],"does_not_own":["Product data-retention policy, database-engine internals, distributed consensus, privacy/legal interpretation, or P2P transport ownership by default."],"escalates_when":["Conflict resolution requires a domain/user decision rather than a mechanical merge.","A feature advertised as local depends materially on an unavailable remote service."]},"intelligence_interface":{"swappable_intelligence":true,"minimum_capabilities":["Preserve exact candidate/environment identity and distinguish direct evidence from inference.","Stop or hand off when a decision exceeds professional ownership."],"adaptation_rules":["Humans, models and machine intelligences may execute equivalent procedures using equivalent tools.","Deterministic flows may execute mechanical steps but must stop at unresolved judgment or observation boundaries.","Changing executor never upgrades evidence, authority, or tested scope."]},"institution_interface":{"reads":["Accepted project/system state relevant to the profession.","Exact candidate, interfaces, dependencies and prior evidence."],"writes":["Bounded implementation/design/evidence packets with exact scope and non-claims.","Explicit handoffs when another profession owns a decision."],"services":["Canonical state reader","Source/version access","Tool registry","Evidence store","Coordination state"],"coordination_contracts":["Cross-profession reuse is contract-only; convenience does not transfer authority.","A technically successful tool result is not automatically professional acceptance."]},"inputs":[{"id":"bounded-task","description":"The bounded professional problem or change to work on.","required":true},{"id":"exact-context","description":"Exact accepted state, candidate identity, environment, interfaces and constraints.","required":true}],"outputs":[{"id":"professional-evidence-packet","description":"Bounded result with exact identity, evidence, limitations and handoffs.","required":true},{"id":"handoff-packet","description":"Cross-profession decision/evidence packet when ownership is exceeded.","required":false}],"knowledge":{"domains":["Offline-capable application architecture.","Local persistence and state authority.","Synchronization, reconciliation, version vectors/conflict representation, and recovery."],"references":[{"id":"onet-software-developers","source":"https://www.onetonline.org/link/summary/15-1252.00","authority":"primary","scope":"Broad Software Developer occupational baseline used as bounded human-work evidence, not profession identity.","version":"O*NET 31.0 / 2026"},{"id":"onet-database-architects","source":"https://www.onetonline.org/link/summary/15-1243.00","authority":"primary","scope":"Adjacent Database Architect occupational baseline used for local state and persistence context, not profession identity.","version":"O*NET 31.0 / 2026"},{"id":"fabric-evidence-standard","source":"docs/EVIDENCE_STANDARD.md","authority":"institutional","scope":"AXM evidence labels and truth boundaries.","version":"0.1"}],"retrieval_rules":["Read exact current project state before relying on summaries.","Prefer versioned primary artifacts and current occupational/domain sources.","Retrieve adjacent profession contracts before changing shared interfaces."],"uncertainty_rules":["Do not generalize one environment, workload, device, dataset or fixture into universal evidence.","Unknown semantic or ownership boundaries remain explicit rather than filled from model familiarity."]},"skills":[{"id":"local-state-authority","description":"Define which state is canonical locally versus cached/derived and how it survives offline operation.","mode":"hybrid","evidence_required":["State authority and persistence identity are explicit."]},{"id":"sync-conflict-design","description":"Design synchronization that preserves divergent state and exposes unresolved semantic conflicts.","mode":"hybrid","evidence_required":["Conflict behavior and non-loss invariants are exercised."]}],"tools":[{"id":"offline-state-harness","purpose":"Exercise local writes, restarts, divergence and resynchronization under controlled connectivity.","allowed_actions":["Simulate offline/online transitions and inspect exact state histories."],"forbidden_actions":["Resolve semantic conflicts by silent last-writer-wins unless the accepted domain contract explicitly says so."],"failure_boundary":"Simulation does not prove production network behavior or domain correctness."}],"procedures":[{"id":"core-work","trigger":"A bounded task falls inside this profession's declared ownership.","steps":["Capture exact accepted state, candidate, interfaces and expected contract.","Map which dimensions are owned here and which require consultation.","Perform the smallest evidence-backed implementation or analysis using declared tools.","Exercise representative success plus boundary or failure conditions.","Record exact evidence labels, limitations and unresolved unknowns.","Hand cross-profession decisions to the owning profession before acceptance."],"stop_conditions":["Required state/version/environment identity is unknown.","The task crosses another profession's authority and no accepted contract resolves it.","Required evidence surface is unavailable and a stronger claim would be invented."],"outputs":["professional-evidence-packet","handoff-packet"]}],"memory":{"canonical":["Validated profession methods, terminology, contracts and evidence rules."],"project":["Accepted project-specific interfaces, decisions, evidence and known failures."],"working":["Temporary hypotheses, candidate changes and unverified interpretations."],"forbidden_to_promote_silently":["Unverified inference","Tool output without professional validation","Temporary workaround","Adjacent profession decision"],"retention_rules":["Promote working information only through explicit evidence-backed transition.","Preserve superseded contracts and rollback identity."]},"state_interfaces":[{"state":"local-first-engineer professional state","access":"propose","reason":"Propose bounded profession-owned changes and evidence."},{"state":"adjacent profession / institution state","access":"read","reason":"Respect dependencies and ownership without absorbing authority."}],"evidence":{"accepted_labels":["TESTED","MEASURED","VISUALLY_INSPECTED","PLAYTESTED","OBSERVED","INFERRED","BLOCKED","NOT_TESTED"],"claim_rules":["Local-first claims name exact local authority, persistence, offline and synchronization conditions.","Offline usability or local caching does not by itself prove local authority, conflict safety, privacy, or lossless synchronization."],"minimum_for_working":["Representative success, failure and abstention fixtures pass in materially different contexts.","At least one external human-work baseline and one real project/practice evidence set challenge the body.","Cross-intelligence portability and boundary behavior are tested before WORKING."]},"decision_rights":{"may_decide":["Bounded technical/professional choices inside declared ownership and evidence."],"must_consult":["Database Engineer for storage-engine/schema internals.","Distributed Systems Engineer for replication/consistency semantics beyond the local-first contract.","Product/Privacy for user-facing data authority/retention choices."],"must_not_decide":["Silently decide user/domain conflict semantics.","Call a remote-dependent cache a canonical local-first state without evidence."]},"handoffs":[{"to":"Database / Distributed Systems / Product / Privacy","when":"Persistence, replication, conflict meaning or data-policy decision exceeds local-first ownership.","required_packet":["state authority","history/conflict evidence","current sync contract","unresolved decision"]}],"failure_library":[{"id":"local-cache-as-canon","symptom":"A cache is treated as authoritative local state without durable ownership semantics.","likely_causes":["Availability was confused with authority."],"checks":["Inspect persistence, invalidation and source-of-truth contracts."],"repair_path":["Narrow claim or define explicit local authority and recovery."]}],"professional_tests":[{"id":"localfirst-offline-write","fixture":"Local and remote replicas diverge while offline and reconnect.","expected_observations":["Preserves both histories or an explicit conflict state rather than silent semantic overwrite."],"pass_condition":"No ungrounded conflict loss occurs."},{"id":"localfirst-hidden-cloud","fixture":"Feature appears local but requires remote validation after restart.","expected_observations":["Identifies the hidden remote dependency and scopes offline claim."],"pass_condition":"Does not claim independent local operation."}],"provenance":{"sources_required":true,"changes_append_only_or_diffable":true,"unknowns_preserved":true},"growth":{"allowed":true,"promotion_requirements":["New capability has source/provenance.","New capability has representative professional fixtures and evidence.","Cross-profession boundaries remain explicit."],"rollback_required":true}}