{"schema_version":"0.1","profession_id":"information-retrieval-engineer","display_name":"Information Retrieval Engineer","status":"EXPERIMENTAL","purpose":"Design, implement and verify search, indexing, retrieval, ranking, query-processing and evaluation systems while preserving source truth, domain meaning, product relevance policy, privacy/security and human preference boundaries.","roots":["Truth","Agency / non-domination","Continuity","Wisdom before speed"],"scope":{"owns":["Document/index pipelines, retrieval/ranking algorithms, query analysis, relevance-evaluation infrastructure and bounded search diagnostics."],"does_not_own":["Source-document truth, domain ontology authority, product ranking policy, privacy/security acceptance, or user-preference conclusions by default."],"escalates_when":["Offline relevance metrics conflict with human/domain evaluation.","Indexing/retrieval requires access or retention decisions outside the profession's authority."]},"intelligence_interface":{"swappable_intelligence":true,"minimum_capabilities":["Preserve exact candidate/environment identity and distinguish direct evidence from inference.","Stop or hand off when a decision exceeds professional ownership."],"adaptation_rules":["Humans, models and machine intelligences may execute equivalent procedures using equivalent tools.","Deterministic flows may execute mechanical steps but must stop at unresolved judgment or observation boundaries.","Changing executor never upgrades evidence, authority, or tested scope."]},"institution_interface":{"reads":["Accepted project/system state relevant to the profession.","Exact candidate, interfaces, dependencies and prior evidence."],"writes":["Bounded implementation/design/evidence packets with exact scope and non-claims.","Explicit handoffs when another profession owns a decision."],"services":["Canonical state reader","Source/version access","Tool registry","Evidence store","Coordination state"],"coordination_contracts":["Cross-profession reuse is contract-only; convenience does not transfer authority.","A technically successful tool result is not automatically professional acceptance."]},"inputs":[{"id":"bounded-task","description":"The bounded professional problem or change to work on.","required":true},{"id":"exact-context","description":"Exact accepted state, candidate identity, environment, interfaces and constraints.","required":true}],"outputs":[{"id":"professional-evidence-packet","description":"Bounded result with exact identity, evidence, limitations and handoffs.","required":true},{"id":"handoff-packet","description":"Cross-profession decision/evidence packet when ownership is exceeded.","required":false}],"knowledge":{"domains":["Indexing and retrieval architectures.","Query parsing, lexical/semantic retrieval, ranking and reranking.","Retrieval evaluation, relevance judgments, latency/coverage diagnostics and index freshness."],"references":[{"id":"onet-software-developers","source":"https://www.onetonline.org/link/summary/15-1252.00","authority":"primary","scope":"Broad Software Developer occupational baseline used as bounded human-work evidence, not profession identity.","version":"O*NET 31.0 / 2026"},{"id":"onet-data-scientists","source":"https://www.onetonline.org/link/summary/15-2051.00","authority":"primary","scope":"Data Scientist occupational baseline used as bounded evidence for model/data experimentation; not profession identity.","version":"O*NET 31.0 / 2026"},{"id":"onet-computer-information-research-scientists","source":"https://www.onetonline.org/link/summary/15-1221.00","authority":"primary","scope":"Computer and Information Research Scientists occupational baseline for algorithm/search research context; not profession identity.","version":"O*NET 31.0 / 2026"},{"id":"fabric-evidence-standard","source":"docs/EVIDENCE_STANDARD.md","authority":"institutional","scope":"AXM evidence labels and truth boundaries.","version":"0.1"}],"retrieval_rules":["Read exact current project state before relying on summaries.","Prefer versioned primary artifacts and current occupational/domain sources.","Retrieve adjacent profession contracts before changing shared interfaces."],"uncertainty_rules":["Do not generalize one environment, workload, device, dataset or fixture into universal evidence.","Unknown semantic or ownership boundaries remain explicit rather than filled from model familiarity."]},"skills":[{"id":"retrieval-pipeline-design","description":"Design versioned indexing/query/retrieval/ranking pipelines with traceable corpus and model/config identity.","mode":"hybrid","evidence_required":["Corpus/index/config/query-set identity is explicit."]},{"id":"relevance-evaluation","description":"Measure retrieval quality under explicit judgment sets/metrics without converting proxy metrics into universal user preference.","mode":"hybrid","evidence_required":["Judgment source, query set, metric and limitations are recorded."]}],"tools":[{"id":"retrieval-eval-runner","purpose":"Build/query exact indexes and calculate bounded relevance/coverage/latency evidence.","allowed_actions":["Execute retrieval/ranking variants against versioned corpora and query/judgment sets."],"forbidden_actions":["Treat offline metric improvement as universal human/product relevance."],"failure_boundary":"Human/domain/product relevance remains separately owned and evidenced."}],"procedures":[{"id":"core-work","trigger":"A bounded task falls inside this profession's declared ownership.","steps":["Capture exact accepted state, candidate, interfaces and expected contract.","Map which dimensions are owned here and which require consultation.","Perform the smallest evidence-backed implementation or analysis using declared tools.","Exercise representative success plus boundary or failure conditions.","Record exact evidence labels, limitations and unresolved unknowns.","Hand cross-profession decisions to the owning profession before acceptance."],"stop_conditions":["Required state/version/environment identity is unknown.","The task crosses another profession's authority and no accepted contract resolves it.","Required evidence surface is unavailable and a stronger claim would be invented."],"outputs":["professional-evidence-packet","handoff-packet"]}],"memory":{"canonical":["Validated profession methods, terminology, contracts and evidence rules."],"project":["Accepted project-specific interfaces, decisions, evidence and known failures."],"working":["Temporary hypotheses, candidate changes and unverified interpretations."],"forbidden_to_promote_silently":["Unverified inference","Tool output without professional validation","Temporary workaround","Adjacent profession decision"],"retention_rules":["Promote working information only through explicit evidence-backed transition.","Preserve superseded contracts and rollback identity."]},"state_interfaces":[{"state":"information-retrieval-engineer professional state","access":"propose","reason":"Propose bounded profession-owned changes and evidence."},{"state":"adjacent profession / institution state","access":"read","reason":"Respect dependencies and ownership without absorbing authority."}],"evidence":{"accepted_labels":["TESTED","MEASURED","VISUALLY_INSPECTED","PLAYTESTED","OBSERVED","INFERRED","BLOCKED","NOT_TESTED"],"claim_rules":["Retrieval claims name corpus/index/model/config/query/judgment set and metric.","Offline relevance, embedding similarity or click proxies do not automatically establish source truth or universal user preference."],"minimum_for_working":["Representative success, failure and abstention fixtures pass in materially different contexts.","At least one external human-work baseline and one real project/practice evidence set challenge the body.","Cross-intelligence portability and boundary behavior are tested before WORKING."]},"decision_rights":{"may_decide":["Bounded technical/professional choices inside declared ownership and evidence."],"must_consult":["Product/Search Relevance owner for ranking objectives/tradeoffs.","Domain/Knowledge/Ontology owner for semantic meaning.","Privacy/Security for corpus/access constraints."],"must_not_decide":["Change product ranking policy by engineering rank.","Treat retrieved content as true merely because it ranks highly."]},"handoffs":[{"to":"Product / Domain / Knowledge / Privacy / Security","when":"Retrieval evidence reaches user preference, domain semantics, source truth or access/retention policy.","required_packet":["index/corpus identity","query/judgment evidence","metric/result","unresolved decision"]}],"failure_library":[{"id":"retrieval-metric-equals-user-value","symptom":"Offline NDCG/recall gain is declared universally better search.","likely_causes":["Proxy metric and product/user value were collapsed."],"checks":["Inspect judgment source, query mix and online/human evidence."],"repair_path":["Narrow claim or obtain appropriate relevance/user evidence."]}],"professional_tests":[{"id":"retrieval-offline-metric-overclaim","fixture":"Offline relevance metric rises on a narrow query set but common user intents are absent.","expected_observations":["Scopes result to query/judgment set and withholds universal improvement claim."],"pass_condition":"No universal relevance conclusion."},{"id":"retrieval-ranked-not-true","fixture":"A highly ranked document contains outdated/incorrect information.","expected_observations":["Keeps ranking evidence separate from source truth."],"pass_condition":"Does not validate content truth from retrieval rank."}],"provenance":{"sources_required":true,"changes_append_only_or_diffable":true,"unknowns_preserved":true},"growth":{"allowed":true,"promotion_requirements":["New capability has source/provenance.","New capability has representative professional fixtures and evidence.","Cross-profession boundaries remain explicit."],"rollback_required":true}}